{
  "action_id": "action-pilot-retrospective",
  "adverse_events": [],
  "claim_ids": [
    "claim-demo-1"
  ],
  "data_commitments": {
    "notes": null,
    "source_digests": [
      {
        "digest": "sha256:aaaaaaaaaaaaaaaaaaaaaaaaaaaaaaaaaaaaaaaaaaaaaaaaaaaaaaaaaaaaaaaa",
        "name": "raw.csv"
      }
    ]
  },
  "delayed_result_status": "not_delayed",
  "environment_context": {
    "instrument_ids": [
      "inst-1"
    ],
    "site": "lab-a",
    "summary": "Lab bench"
  },
  "evidence_classes": [
    "empirically_measured",
    "human_reviewed"
  ],
  "external_refs": [],
  "integrity": {
    "content_digest": "sha256:66148ef186947af37fb80a1452e9be41fef1027b6e3f99940034d0aecc144052",
    "created_at": "2026-07-02T12:00:00Z",
    "schema_version": "v1",
    "writer_identity": "fixture-builder"
  },
  "intervention_performed": {
    "performed_at": "2026-07-02T00:00:00Z",
    "summary": "Ran protocol A"
  },
  "measured_result": {
    "result_kind": "quantitative",
    "summary": "Yield within band",
    "units": "fraction",
    "value": 0.82
  },
  "missing_data": {
    "fields": [],
    "has_missing_data": false
  },
  "outcome_id": "outcome-1",
  "pcs_claim_ids": [],
  "privacy": "public",
  "proposed_action_id": "pa-1",
  "protocol": {
    "description": "Synthetic protocol",
    "protocol_id": "proto-1",
    "version": "1"
  },
  "protocol_deviations": [],
  "replication_status": "not_attempted",
  "reviewer_assessment": {
    "notes": null,
    "reviewer_identity": "reviewer-1",
    "status": "accepted"
  },
  "schema_version": "v1",
  "scientific_question_id": "q-1",
  "uncertainty": {
    "quantitative": null,
    "statement": "\u00b15% relative"
  }
}
